<?xml version="1.0" encoding="UTF-8"?>
<tns:lwam xmlns:tns="http://www.ericsson.com/am/xsd" xmlns:xsi="http://www.w3.org/2001/XMLSchema-instance" xsi:schemaLocation="http://www.ericsson.com/am/xsd lwam.xsd ">
  <tns:globalsettings>
    <tns:session timeout="0" timeunit="DAYS"/>
    <tns:http connectionTimeout="0" idleConnectionsHandlerInterval="0" socketTimeToLive="0" socketTimeout="0"/>
  </tns:globalsettings>
  <tns:security>
    <tns:keystore password="" path=""/>
    <tns:X509HostnameVerifier value="STRICT_HOSTNAME_VERIFIER"/>
  </tns:security>
  <tns:modules/>
</tns:lwam>
